{
  "definitionId": "f-collections-output-01",
  "version": 1,
  "locale": "de",
  "title": "Dictionary-Zustand vorhersagen",
  "competencyIds": ["c-python-collections", "c-python-reading"],
  "activityType": "predict-output",
  "graderId": "deterministic",
  "generatorId": null,
  "referenceSolverId": null,
  "deterministicSeed": 2201,
  "prompt": "Sage die Ausgabe voraus, ohne den Code auszuführen.",
  "parameters": { "snippet": "counts = {}\nfor word in [\"rot\", \"blau\", \"rot\"]:\n    counts[word] = counts.get(word, 0) + 1\nprint(counts[\"rot\"], len(counts))" },
  "expectedAnswer": { "kind": "output-lines", "output": "2 2" },
  "tolerancePolicy": { "mode": "whitespace-normalized" },
  "hints": ["Trace den Inhalt von counts nach jedem Wort.", "len(counts) zählt verschiedene Schlüssel, nicht alle Wörter."],
  "feedbackRules": [{ "if": "element-count-mismatch", "then": "print gibt zwei Zahlen aus: die Häufigkeit von rot und die Zahl der Schlüssel." }],
  "fullSolution": "rot wird zweimal gezählt. Das Dictionary enthält die zwei Schlüssel rot und blau. Die Ausgabe ist 2 2.",
  "difficulty": 2,
  "estimatedMinutes": 8,
  "sourceLineage": { "statement": "eigenständig entwickelte Predict-Aufgabe", "seed": 2201 },
  "rightsId": "ki-lernplattform-original",
  "releaseStatus": "solver-verified",
  "testedSeedCount": 1,
  "masteryEligible": true,
  "active": true,
  "legacyWeekId": "w02"
}
