{
  "definitionId": "f-python-state-trace-01",
  "version": 1,
  "locale": "de",
  "title": "Variablenzustand über mehrere Zuweisungen",
  "competencyIds": [
    "c-python-basics",
    "c-python-reading"
  ],
  "activityType": "predict-output",
  "graderId": "deterministic",
  "generatorId": "genPythonStateTrace",
  "referenceSolverId": null,
  "deterministicSeed": 3101,
  "prompt": "Was gibt dieses Programm aus? Erst alle Zuweisungen Zeile für Zeile nachvollziehen — insbesondere, wann eine Variable überschrieben wird —, dann die Ausgabezeile angeben (Zahlen durch Leerzeichen getrennt).",
  "parameters": {
    "seedGenerator": "genPythonStateTrace",
    "shape": "chain3",
    "x0": 9,
    "k1": -3,
    "k2": 10,
    "snippet": "x = 9\ny = x * (-3)\nz = y - x\nx = z + (10)\nprint(x, y, z)"
  },
  "expectedAnswer": {
    "kind": "seeded-output",
    "generator": "genPythonStateTrace",
    "defaultSeed": 3101,
    "defaultOutput": "-26 -27 -36"
  },
  "tolerancePolicy": {
    "mode": "exact"
  },
  "hints": [
    "Jede Zuweisung liest rechts den aktuellen Zustand, bevor die linke Seite überschrieben wird.",
    "Notiere nach jeder Zeile die Werte aller Variablen — die print-Zeile nennt die Reihenfolge der Ausgabe."
  ],
  "feedbackRules": [],
  "fullSolution": "Zeile für Zeile: x = 9 · y = x * (-3) · z = y - x · x = z + (10) · print(x, y, z). Die print-Zeile gibt x y z in dieser Reihenfolge aus: -26 -27 -36. Entscheidend: Zuweisungen rechts lesen den aktuellen Zustand, bevor die linke Seite überschrieben wird.",
  "difficulty": 2,
  "estimatedMinutes": 8,
  "sourceLineage": {
    "statement": "eigenständig entwickelt (Seed-Generator genPythonStateTrace)",
    "seed": 3101
  },
  "rightsId": "ki-lernplattform-original",
  "releaseStatus": "solver-verified",
  "testedSeedCount": 2000,
  "masteryEligible": true,
  "active": true,
  "legacyWeekId": "w01"
}
