{
  "definitionId": "f-control-flow-output-01",
  "version": 1,
  "locale": "de",
  "title": "Verzweigungen und Schleifen vorhersagen",
  "competencyIds": [
    "c-python-control-flow"
  ],
  "activityType": "predict-output",
  "graderId": "deterministic",
  "generatorId": "genControlFlowOutput",
  "referenceSolverId": null,
  "deterministicSeed": 3501,
  "prompt": "Was gibt dieses Programm aus? Die Schleife vollständig durchlaufen (auch den Abbruch) — zwei Zahlen in einer Zeile.",
  "parameters": {
    "seedGenerator": "genControlFlowOutput",
    "shape": "while",
    "n0": 7,
    "step": 2,
    "stop": 3,
    "iterations": 2,
    "snippet": "n = 7\nsumme = 0\nwhile n > 3:\n    summe = summe + n\n    n = n - 2\nprint(summe, n)"
  },
  "expectedAnswer": {
    "kind": "seeded-output",
    "generator": "genControlFlowOutput",
    "defaultSeed": 3501,
    "defaultOutput": "12 3"
  },
  "tolerancePolicy": {
    "mode": "exact"
  },
  "hints": [
    "Bei if/elif/elif läuft genau der erste Zweig, dessen Bedingung wahr ist — die weiteren werden nicht mehr geprüft.",
    "Bei der while-Schleife den Wert nach dem letzten Durchlauf mitdenken: Auch der Abbruchzustand wird geprintet."
  ],
  "feedbackRules": [],
  "fullSolution": "Durchläufe: n=7, summe=7 · n=5, summe=12. Die Schleife endet bei n = 3 (n > 3 ist dann falsch). Ausgabe: 12 3.",
  "difficulty": 2,
  "estimatedMinutes": 8,
  "sourceLineage": {
    "statement": "eigenständig entwickelt (Seed-Generator genControlFlowOutput)",
    "seed": 3501
  },
  "rightsId": "ki-lernplattform-original",
  "releaseStatus": "solver-verified",
  "testedSeedCount": 2000,
  "masteryEligible": true,
  "active": true,
  "legacyWeekId": "w02"
}
