{
  "definitionId": "f-algebra-debug-01",
  "version": 1,
  "locale": "de",
  "title": "Fehler im Potenzgesetz finden",
  "competencyIds": ["c-algebra"],
  "activityType": "single-choice",
  "graderId": "deterministic",
  "generatorId": null,
  "referenceSolverId": null,
  "deterministicSeed": 2002,
  "prompt": "Eine Lösung behauptet `2^3 · 2^4 = 4^7`. Welche Diagnose trifft den ersten Fehler?",
  "parameters": {},
  "choices": [
    { "id": "a", "text": "Bei gleicher Basis werden die Exponenten addiert, aber die Basis bleibt 2.", "correct": true },
    { "id": "b", "text": "Die Exponenten müssten multipliziert werden.", "correct": false },
    { "id": "c", "text": "Potenzen dürfen nie multipliziert werden.", "correct": false },
    { "id": "d", "text": "Nur das Ergebnis 7 ist falsch; die Basis 4 stimmt.", "correct": false }
  ],
  "expectedAnswer": { "correctChoice": "a" },
  "tolerancePolicy": { "mode": "none" },
  "hints": ["Schreibe beide Faktoren als wiederholte Multiplikation mit derselben Basis.", "Die Regel lautet `a^m · a^n = a^(m+n)`."],
  "feedbackRules": [{ "if": "choice !== 'a'", "then": "Trenne in der Regel die Rolle der Basis von der Rolle der Exponenten." }],
  "fullSolution": "`2^3 · 2^4 = 2^(3+4) = 2^7`. Die Basis wird nicht zu 4.",
  "difficulty": 2,
  "estimatedMinutes": 6,
  "sourceLineage": { "statement": "eigenständig entwickelte Fehlerdiagnose", "seed": 2002 },
  "rightsId": "ki-lernplattform-original",
  "releaseStatus": "solver-verified",
  "testedSeedCount": 1,
  "masteryEligible": true,
  "active": true,
  "legacyWeekId": null
}
