{
  "definitionId": "f-code-reading-output-01",
  "version": 1,
  "locale": "de",
  "title": "Ausdrücke lesen: Slices, join und Listenabstraktion",
  "competencyIds": [
    "c-python-reading"
  ],
  "activityType": "predict-output",
  "graderId": "deterministic",
  "generatorId": "genCodeReadingOutput",
  "referenceSolverId": null,
  "deterministicSeed": 3201,
  "prompt": "Was gibt dieses Programm aus? String-Methoden wandeln schrittweise um.",
  "parameters": {
    "seedGenerator": "genCodeReadingOutput",
    "shape": "transform",
    "word": "  datenbank ",
    "mode": 1,
    "snippet": "t = \"  datenbank \"\nprint(t.strip().title())"
  },
  "expectedAnswer": {
    "kind": "seeded-output",
    "generator": "genCodeReadingOutput",
    "defaultSeed": 3201,
    "defaultOutput": "Datenbank"
  },
  "tolerancePolicy": {
    "mode": "exact"
  },
  "hints": [
    "Slices sind start-inklusiv und stop-exklusiv: s[a:b] nimmt die Zeichen ab Position a bis vor Position b.",
    "Listen erscheinen in der Ausgabe in Python-Schreibweise mit eckigen Klammern, z. B. [1, 2]."
  ],
  "feedbackRules": [],
  "fullSolution": "strip() entfernt die Rand-Leerzeichen, title() schreibt jeden Wortanfang groß. Ergebnis: Datenbank.",
  "difficulty": 2,
  "estimatedMinutes": 7,
  "sourceLineage": {
    "statement": "eigenständig entwickelt (Seed-Generator genCodeReadingOutput)",
    "seed": 3201
  },
  "rightsId": "ki-lernplattform-original",
  "releaseStatus": "solver-verified",
  "testedSeedCount": 2000,
  "masteryEligible": true,
  "active": true,
  "legacyWeekId": "w02"
}
