{
  "definitionId": "f-collections-choice-01",
  "version": 1,
  "locale": "de",
  "title": "Passende Struktur für Duplikate",
  "competencyIds": ["c-python-collections"],
  "activityType": "single-choice",
  "graderId": "deterministic",
  "generatorId": null,
  "referenceSolverId": null,
  "deterministicSeed": 2202,
  "prompt": "Du verarbeitest IDs in Reihenfolge und willst bei jeder ID schnell prüfen, ob sie bereits vorkam. Welche zusätzliche Struktur passt am besten?",
  "parameters": {},
  "choices": [
    { "id": "a", "text": "Ein Set `seen`, das jede erstmals gelesene ID aufnimmt.", "correct": true },
    { "id": "b", "text": "Eine Zahl, die nur die bisherige Zeilenanzahl speichert.", "correct": false },
    { "id": "c", "text": "Ein String mit allen IDs ohne Trennzeichen.", "correct": false },
    { "id": "d", "text": "Nur die zuletzt gelesene ID.", "correct": false }
  ],
  "expectedAnswer": { "correctChoice": "a" },
  "tolerancePolicy": { "mode": "none" },
  "hints": ["Gesucht ist eine Struktur für Mitgliedschaftsfragen.", "Die Reihenfolge bleibt in der ursprünglichen Zeilenliste; seen muss sie nicht nochmals speichern."],
  "feedbackRules": [{ "if": "choice !== 'a'", "then": "Prüfe, welche Struktur Eindeutigkeit und Mitgliedschaft direkt modelliert." }],
  "fullSolution": "Ein Set speichert eindeutige IDs. `id in seen` prüft, ob die ID bereits verarbeitet wurde.",
  "difficulty": 1,
  "estimatedMinutes": 6,
  "sourceLineage": { "statement": "eigenständig entwickelte Auswahlaufgabe", "seed": 2202 },
  "rightsId": "ki-lernplattform-original",
  "releaseStatus": "solver-verified",
  "testedSeedCount": 1,
  "masteryEligible": true,
  "active": true,
  "legacyWeekId": "w02"
}
