{
  "definitionId": "f-linalg-final-boss-01",
  "version": 1,
  "locale": "de",
  "title": "Final Boss: shape-sichere lineare Algebra",
  "competencyIds": ["c-linalg-matrices", "c-linalg-systems", "c-linalg-gauss", "c-linalg-independence", "c-numpy-basics"],
  "activityType": "python-code",
  "graderId": "pyodide",
  "generatorId": null,
  "referenceSolverId": null,
  "deterministicSeed": 5801,
  "prompt": "Implementiere drei Funktionen: `shape_safe_matmul(A, B)` prüft 2D-Shapes und multipliziert Matrizen; `gauss_rank(A)` bestimmt den Rang über Pivot-Elimination; `solve_system(A, b)` löst ein quadratisches System mit eindeutiger Lösung. Die Tests enthalten rechteckige Matrizen, abhängige Zeilen und Fehlerfälle.",
  "parameters": {
    "packages": ["numpy"],
    "starterCode": "import numpy as np\n\n\ndef shape_safe_matmul(A, B):\n    pass\n\n\ndef gauss_rank(A):\n    pass\n\n\ndef solve_system(A, b):\n    pass\n",
    "tests": "import numpy as np\n\n__check('2x3 @ 3x2', np.array_equal(shape_safe_matmul([[1,2,3],[4,5,6]], [[1,0],[0,1],[1,1]]), np.array([[4,5],[10,11]])))\n__check('rechteckiges Produkt', np.array_equal(shape_safe_matmul([[2,-1]], [[3],[4]]), np.array([[2]])))\ntry:\n    shape_safe_matmul([[1,2]], [[1,2]])\n    __check('inkompatible Shapes abgelehnt', False, 'kein ValueError')\nexcept ValueError:\n    __check('inkompatible Shapes abgelehnt', True)\nexcept Exception as exc:\n    __check('inkompatible Shapes abgelehnt', False, type(exc).__name__)\n__check('Rang 2 bei abhängiger Zeile', gauss_rank([[1,0,1],[0,1,1],[1,1,2]]) == 2)\n__check('Rang 3 bei Vollrang', gauss_rank([[2,1,0],[0,3,1],[1,0,2]]) == 3)\n__check('Rang 1 bei Vielfachen', gauss_rank([[1,2],[2,4],[-3,-6]]) == 1)\n__s1 = solve_system([[2,1],[1,-3]], [5,-8])\n__check('2x2-System', np.allclose(__s1, np.array([1,3])))\n__s2 = solve_system([[3,1,0],[1,4,1],[0,2,5]], [7,12,17])\n__check('3x3-System', np.allclose(np.asarray([[3,1,0],[1,4,1],[0,2,5]]) @ np.asarray(__s2), np.array([7,12,17])))"
  },
  "expectedAnswer": { "kind": "python-tests", "requiredFunctions": ["shape_safe_matmul", "gauss_rank", "solve_system"] },
  "tolerancePolicy": { "mode": "deterministic-tests", "absoluteTolerance": 1e-8 },
  "hints": ["Normalisiere Eingaben zuerst mit `np.asarray`; prüfe danach ndim und innere Dimensionen.", "Für den Rang: Suche pro Spalte einen von null verschiedenen Pivot, vertausche Zeilen und eliminiere darunter.", "Trenne Shape-Validierung, Rangalgorithmus und Systemlösung in drei kleine Verträge."],
  "feedbackRules": [],
  "fullSolution": "<pre><code>def shape_safe_matmul(A, B):\n    A = np.asarray(A)\n    B = np.asarray(B)\n    if A.ndim != 2 or B.ndim != 2 or A.shape[1] != B.shape[0]:\n        raise ValueError(\"inkompatible Shapes\")\n    return A @ B\n\ndef gauss_rank(A):\n    M = np.asarray(A, dtype=float).copy()\n    row = 0\n    for col in range(M.shape[1]):\n        pivots = np.flatnonzero(np.abs(M[row:, col]) &gt; 1e-10)\n        if not len(pivots):\n            continue\n        pivot = row + pivots[0]\n        M[[row, pivot]] = M[[pivot, row]]\n        M[row] /= M[row, col]\n        for lower in range(row + 1, M.shape[0]):\n            M[lower] -= M[lower, col] * M[row]\n        row += 1\n        if row == M.shape[0]:\n            break\n    return row\n\ndef solve_system(A, b):\n    A = np.asarray(A, dtype=float)\n    b = np.asarray(b, dtype=float)\n    if A.ndim != 2 or A.shape[0] != A.shape[1] or b.shape != (A.shape[0],):\n        raise ValueError(\"inkompatible Shapes\")\n    return np.linalg.solve(A, b)</code></pre>", 
  "difficulty": 4,
  "estimatedMinutes": 45,
  "sourceLineage": { "statement": "Eigenständig entwickelte Transferaufgabe aus den öffentlichen Matrix-, Gauß- und NumPy-Lektionen.", "seed": 5801 },
  "rightsId": "ki-lernplattform-original",
  "releaseStatus": "solver-verified",
  "testedSeedCount": 1,
  "masteryEligible": true,
  "active": true,
  "legacyWeekId": null,
  "workedExample": null,
  "rubric": null,
  "typicalErrors": ["Shape-Prüfung nach statt vor der Operation", "Pivotspalte ohne Zeilentausch überspringen", "nur einen bekannten Testfall hartcodieren"]
}
