{
  "definitionId": "f-algebra-equivalence-01",
  "version": 1,
  "locale": "de",
  "title": "Äquivalente Umformung wählen",
  "competencyIds": ["c-algebra", "c-algebra-basics"],
  "activityType": "single-choice",
  "graderId": "deterministic",
  "generatorId": null,
  "referenceSolverId": null,
  "deterministicSeed": 2001,
  "prompt": "Welche nächste Gleichung ist zu `3(x + 2) = 15` äquivalent und isoliert den Klammerausdruck korrekt?",
  "parameters": {},
  "choices": [
    { "id": "a", "text": "x + 2 = 5", "correct": true },
    { "id": "b", "text": "x + 2 = 12", "correct": false },
    { "id": "c", "text": "3x + 2 = 15", "correct": false },
    { "id": "d", "text": "x + 6 = 5", "correct": false }
  ],
  "expectedAnswer": { "correctChoice": "a" },
  "tolerancePolicy": { "mode": "none" },
  "hints": ["Behandle `x + 2` zunächst als einen Ausdruck.", "Teile beide Seiten vollständig durch 3."],
  "feedbackRules": [{ "if": "choice !== 'a'", "then": "Dieselbe Operation muss die gesamte linke und rechte Seite betreffen." }],
  "fullSolution": "Beide Seiten durch 3 teilen ergibt `x + 2 = 5`. Erst danach folgt `x = 3`.",
  "difficulty": 1,
  "estimatedMinutes": 6,
  "sourceLineage": { "statement": "eigenständig entwickelte Äquivalenzaufgabe", "seed": 2001 },
  "rightsId": "ki-lernplattform-original",
  "releaseStatus": "solver-verified",
  "testedSeedCount": 1,
  "masteryEligible": true,
  "active": true,
  "legacyWeekId": null
}
