{
  "definitionId": "f-linalg-matmul-entry-01",
  "version": 1,
  "locale": "de",
  "title": "Matrixprodukt-Eintrag mit frischen Zahlen",
  "competencyIds": [
    "c-linalg-matrices"
  ],
  "activityType": "numeric",
  "graderId": "deterministic",
  "generatorId": "genMatmulEntryFresh",
  "referenceSolverId": null,
  "deterministicSeed": 4101,
  "prompt": "Gegeben sind die Matrizen\n\nA =\n[ -1    2]\n[ -1   -1]\n\nB =\n[  3   -2]\n[  1   -2]\n\nBerechne den Eintrag c_21 des Produkts C = A·B und gib ihn als ganze Zahl ein.",
  "parameters": {
    "seedGenerator": "genMatmulEntryFresh",
    "A": [
      [
        -1,
        2
      ],
      [
        -1,
        -1
      ]
    ],
    "B": [
      [
        3,
        -2
      ],
      [
        1,
        -2
      ]
    ],
    "entry": [
      2,
      1
    ]
  },
  "expectedAnswer": {
    "kind": "seeded-integer",
    "generator": "genMatmulEntryFresh",
    "defaultSeed": 4101,
    "defaultExpected": -4
  },
  "tolerancePolicy": {
    "mode": "exact"
  },
  "hints": [
    "c_ij ist das Skalarprodukt der i-ten Zeile von A mit der j-ten Spalte von B.",
    "Zeile und Spalte elementweise multiplizieren und die Produkte summieren."
  ],
  "feedbackRules": [],
  "fullSolution": "c_21 ist das Skalarprodukt der 2. Zeile von A mit der 1. Spalte von B: -1·3 + -1·1 = -4.",
  "difficulty": 2,
  "estimatedMinutes": 7,
  "sourceLineage": {
    "statement": "eigenständig entwickelt (Seed-Generator genMatmulEntryFresh)",
    "seed": 4101
  },
  "rightsId": "ki-lernplattform-original",
  "releaseStatus": "solver-verified",
  "testedSeedCount": 2000,
  "masteryEligible": true,
  "active": true,
  "legacyWeekId": "w05"
}
