{
  "definitionId": "f-linalg-rank-system-debug-01",
  "version": 1,
  "locale": "de",
  "title": "Pivotstruktur und Lösungsmenge diagnostizieren",
  "competencyIds": ["c-linalg-systems", "c-linalg-gauss", "c-linalg-independence"],
  "activityType": "single-choice",
  "graderId": "deterministic",
  "generatorId": null,
  "referenceSolverId": null,
  "deterministicSeed": 5702,
  "prompt": "Nach korrekter Gauß-Elimination eines Systems mit drei Variablen entsteht $\\left(\\begin{array}{ccc|c}1&0&2&3\\\\0&1&-1&4\\\\0&0&0&0\\end{array}\\right)$. Welche Diagnose ist vollständig korrekt?",
  "parameters": {},
  "choices": [
    { "id": "rank-two-free", "text": "Rang 2, eine freie Variable und unendlich viele Lösungen", "correct": true },
    { "id": "rank-three-unique", "text": "Rang 3 und genau eine Lösung", "correct": false },
    { "id": "contradiction", "text": "Keine Lösung, weil die letzte Zeile nur Nullen enthält", "correct": false },
    { "id": "rank-zero", "text": "Rang 0, weil eine Nullzeile vorkommt", "correct": false }
  ],
  "expectedAnswer": { "kind": "choice", "choiceId": "rank-two-free" },
  "tolerancePolicy": { "mode": "exact" },
  "hints": ["Zähle die Pivotzeilen, nicht die Gesamtzahl der Zeilen.", "Eine Zeile $0=0$ ist kein Widerspruch; vergleiche Pivotzahl und Variablenzahl."],
  "feedbackRules": [{ "if": "contradiction", "then": "Ein Widerspruch hätte rechts einen von null verschiedenen Wert, zum Beispiel $0=4$." }],
  "fullSolution": "Es gibt zwei Pivotpositionen, also Rang 2. Bei drei Variablen bleibt eine Variable frei. Die Nullzeile bedeutet $0=0$ und erzeugt keinen Widerspruch; daher gibt es unendlich viele Lösungen.",
  "difficulty": 3,
  "estimatedMinutes": 10,
  "sourceLineage": { "statement": "Eigenständig entwickelte Diagnoseaufgabe zu Pivotstruktur, Rang und Lösungsfällen.", "seed": 5702 },
  "rightsId": "ki-lernplattform-original",
  "releaseStatus": "solver-verified",
  "testedSeedCount": 1,
  "masteryEligible": true,
  "active": true,
  "legacyWeekId": null,
  "workedExample": null,
  "rubric": null,
  "typicalErrors": ["Nullzeile als Widerspruch lesen", "Rang mit Zeilenzahl verwechseln", "freie Variable übersehen"]
}
