{
  "definitionId": "f-git-choice-01",
  "version": 1,
  "locale": "de",
  "title": "Diff vor dem Commit prüfen",
  "competencyIds": ["c-git-basics"],
  "activityType": "single-choice",
  "graderId": "deterministic",
  "generatorId": null,
  "referenceSolverId": null,
  "deterministicSeed": 2501,
  "prompt": "Welcher Befehl zeigt den Inhalt noch nicht vorgemerkter Änderungen, bevor du Dateien für einen Commit auswählst?",
  "parameters": {},
  "choices": [
    { "id": "a", "text": "git diff", "correct": true },
    { "id": "b", "text": "git push", "correct": false },
    { "id": "c", "text": "git clone", "correct": false },
    { "id": "d", "text": "git tag", "correct": false }
  ],
  "expectedAnswer": { "correctChoice": "a" },
  "tolerancePolicy": { "mode": "none" },
  "hints": ["Gesucht ist eine reine Leseoperation.", "status nennt Dateien; diff zeigt die Textänderungen."],
  "feedbackRules": [{ "if": "choice !== 'a'", "then": "Wähle keinen Befehl mit Remote- oder Historieneffekt." }],
  "fullSolution": "`git diff` zeigt die noch nicht vorgemerkten Textänderungen. `git status` ergänzt die Dateiansicht.",
  "difficulty": 1,
  "estimatedMinutes": 5,
  "sourceLineage": { "statement": "eigenständig entwickelte Git-Aufgabe", "seed": 2501 },
  "rightsId": "ki-lernplattform-original",
  "releaseStatus": "solver-verified",
  "testedSeedCount": 1,
  "masteryEligible": true,
  "active": true,
  "legacyWeekId": "w03"
}
