{
  "definitionId": "f-function-compose-01",
  "version": 1,
  "locale": "de",
  "title": "Funktionskomposition in beiden Reihenfolgen",
  "competencyIds": [
    "c-python-functions"
  ],
  "activityType": "predict-output",
  "graderId": "deterministic",
  "generatorId": "genFunctionCompose",
  "referenceSolverId": null,
  "deterministicSeed": 3301,
  "prompt": "Was gibt dieses Programm aus? Beide Aufrufe genau in der gedruckten Reihenfolge berechnen — die Reihenfolge der Anwendung ist Teil der Aufgabe. Zwei Zahlen in einer Zeile, durch Leerzeichen getrennt.",
  "parameters": {
    "seedGenerator": "genFunctionCompose",
    "fa": 3,
    "fb": -1,
    "ga": -1,
    "gb": -3,
    "v": 4,
    "snippet": "def f(x):\n    return 3 * x + (-1)\n\ndef g(x):\n    return -1 * x + (-3)\n\nprint(f(g(4)), g(f(4)))"
  },
  "expectedAnswer": {
    "kind": "seeded-output",
    "generator": "genFunctionCompose",
    "defaultSeed": 3301,
    "defaultOutput": "-22 -14"
  },
  "tolerancePolicy": {
    "mode": "exact"
  },
  "hints": [
    "Erst die innere Funktion auswerten — ihr Ergebnis ist das Argument der äußeren.",
    "Die beiden Aufrufe f(g(v)) und g(f(v)) getrennt durchrechnen; beide Ergebnisse stehen in einer Ausgabezeile."
  ],
  "feedbackRules": [],
  "fullSolution": "g(4) = -1 · 4 + -3 = -7; f(-7) = 3 · -7 + -1 = -22. Andersherum: f(4) = 11; g(11) = -1 · 11 + -3 = -14. Ausgabe: -22 -14. Die beiden Bahnen unterscheiden sich, weil die Funktionen nicht vertauschbar sind.",
  "difficulty": 2,
  "estimatedMinutes": 8,
  "sourceLineage": {
    "statement": "eigenständig entwickelt (Seed-Generator genFunctionCompose)",
    "seed": 3301
  },
  "rightsId": "ki-lernplattform-original",
  "releaseStatus": "solver-verified",
  "testedSeedCount": 2000,
  "masteryEligible": true,
  "active": true,
  "legacyWeekId": "w01"
}
