{
  "definitionId": "f-data-code-repair-01",
  "version": 1,
  "locale": "de",
  "title": "Code Repair: Datensätze prüfen",
  "competencyIds": ["c-python-reading", "c-python-collections", "c-python-files-errors", "c-testing-debugging"],
  "activityType": "python-code",
  "graderId": "pyodide",
  "generatorId": null,
  "referenceSolverId": null,
  "deterministicSeed": 2501,
  "prompt": "Repariere `inspect_rows(rows)`. Für ungültige Alterswerte soll ein Issue `('invalid-age', id)` entstehen, für jede wiederholte ID ein Issue `('duplicate-id', id)`. Der Startercode setzt `seen` an der falschen Stelle zurück und verschluckt Parsingfehler.",
  "parameters": {
    "taskMode": "repair",
    "packages": [],
    "starterCode": "def inspect_rows(rows):\n    issues = []\n    for row in rows:\n        seen = set()\n        try:\n            int(row['age'])\n        except Exception:\n            pass\n        if row['id'] in seen:\n            issues.append(('duplicate-id', row['id']))\n        seen.add(row['id'])\n    return issues\n",
    "tests": "__rows = [{'id':'a','age':'18'},{'id':'b','age':'x'},{'id':'a','age':'21'}]\n__check('Typ- und Duplikatfehler', inspect_rows(__rows) == [('invalid-age','b'),('duplicate-id','a')])\n__check('leere Eingabe', inspect_rows([]) == [])\n__check('gültige eindeutige Zeilen', inspect_rows([{'id':'a','age':'0'},{'id':'b','age':'-2'}]) == [])\n__twice = [{'id':'z','age':'bad'},{'id':'z','age':'bad'}]\n__check('Fehlerreihenfolge pro Zeile', inspect_rows(__twice) == [('invalid-age','z'),('invalid-age','z'),('duplicate-id','z')])"
  },
  "expectedAnswer": { "kind": "python-tests", "requiredFunction": "inspect_rows" },
  "tolerancePolicy": { "mode": "deterministic-tests" },
  "hints": ["`seen` muss über mehrere Schleifendurchläufe bestehen bleiben.", "Fange nur `ValueError` ab und erzeuge im Handler den konkreten Issue-Eintrag."],
  "feedbackRules": [],
  "fullSolution": "<pre><code>def inspect_rows(rows):\n    issues = []\n    seen = set()\n    for row in rows:\n        try:\n            int(row['age'])\n        except ValueError:\n            issues.append(('invalid-age', row['id']))\n        if row['id'] in seen:\n            issues.append(('duplicate-id', row['id']))\n        seen.add(row['id'])\n    return issues</code></pre>",
  "difficulty": 3,
  "estimatedMinutes": 20,
  "sourceLineage": { "statement": "Eigenständig entwickelte Code-Repair-Aufgabe als Brücke zum lokalen Datenprüfer-Projekt.", "seed": 2501 },
  "rightsId": "ki-lernplattform-original",
  "releaseStatus": "solver-verified",
  "testedSeedCount": 1,
  "masteryEligible": true,
  "active": true,
  "legacyWeekId": "w04",
  "workedExample": null,
  "rubric": null,
  "typicalErrors": ["Zustand im Schleifenkörper zurücksetzen", "Exception zu breit fangen", "Fehlerreihenfolge verlieren"]
}
