{
  "definitionId": "f-branch-coverage-01",
  "version": 1,
  "locale": "de",
  "title": "Zweigabdeckung zählen",
  "competencyIds": [
    "c-testing-debugging"
  ],
  "activityType": "numeric",
  "graderId": "deterministic",
  "generatorId": "genBranchCoverageCount",
  "referenceSolverId": null,
  "deterministicSeed": 3801,
  "prompt": "Wie viele Testfälle sind mindestens nötig, um jede Verzweigung dieses Codegerüsts in jede Richtung mindestens einmal wirklich zu durchlaufen (vollständige Zweigabdeckung)? Erst die erreichbaren Wege durch den Entscheidungsbaum zählen — dann als ganze Zahl angeben.\n\n1  if a > 0:\n2      if b > 0:\n3          print(\"beide\")\n4  print(\"ende\")",
  "parameters": {
    "seedGenerator": "genBranchCoverageCount",
    "shape": "if-if"
  },
  "expectedAnswer": {
    "kind": "seeded-integer",
    "generator": "genBranchCoverageCount",
    "defaultSeed": 3801,
    "defaultExpected": 3
  },
  "tolerancePolicy": {
    "mode": "exact"
  },
  "hints": [
    "Zweigabdeckung verlangt jede Verzweigung in beide Richtungen: Jede Bedingung muss mindestens einmal wahr und einmal falsch werden.",
    "Zähle die Blätter des Entscheidungsbaums — geschachtelte Bedingungen vervielfachen die erreichbaren Wege."
  ],
  "feedbackRules": [],
  "fullSolution": "Der Entscheidungsbaum dieses Gerüsts hat 3 erreichbare Blätter (jede Kombination von Bedingungsausgängen, die zu einem unterscheidbaren Programmweg führt). Zweigabdeckung verlangt für jedes Blatt mindestens einen Testfall mit Werten, die genau auf diesem Weg landen — also mindestens 3 Testfälle.",
  "difficulty": 2,
  "estimatedMinutes": 7,
  "sourceLineage": {
    "statement": "eigenständig entwickelt (Seed-Generator genBranchCoverageCount)",
    "seed": 3801
  },
  "rightsId": "ki-lernplattform-original",
  "releaseStatus": "solver-verified",
  "testedSeedCount": 2000,
  "masteryEligible": true,
  "active": true,
  "legacyWeekId": "w04"
}
