{
  "definitionId": "f-testing-parsons-01",
  "version": 1,
  "locale": "de",
  "title": "Arrange, Act, Assert ordnen",
  "competencyIds": ["c-testing-debugging"],
  "activityType": "parsons",
  "graderId": "deterministic",
  "generatorId": null,
  "referenceSolverId": null,
  "deterministicSeed": 2401,
  "prompt": "Ordne einen kleinen Test nach Arrange, Act, Assert. Eine Zeile würde die Erwartung dem fehlerhaften Ergebnis anpassen und gehört nicht hinein.",
  "parameters": {
    "fragments": [
      { "id": "p1", "text": "rows = [{\"id\": \"a1\"}, {\"id\": \"a1\"}]" },
      { "id": "p2", "text": "issues = duplicate_issues(rows)" },
      { "id": "p3", "text": "assert issues == [{\"row\": 3, \"value\": \"a1\"}]" },
      { "id": "d1", "text": "expected = issues" }
    ],
    "initialOrder": ["p3", "d1", "p2", "p1"]
  },
  "expectedAnswer": { "kind": "ordered-lines", "solutionOrder": ["p1", "p2", "p3"], "distractors": ["d1"] },
  "tolerancePolicy": { "mode": "exact-order" },
  "hints": ["Baue zuerst die Eingabe, führe dann die Funktion aus.", "Die Erwartung muss unabhängig vom tatsächlichen Ergebnis formuliert sein."],
  "feedbackRules": [{ "if": "order-length-mismatch", "then": "Arrange, Act und Assert brauchen hier genau drei Zeilen." }],
  "fullSolution": "Die feste Eingabe kommt zuerst, danach der Funktionsaufruf und zuletzt der Vergleich mit einer unabhängig notierten Erwartung.",
  "difficulty": 2,
  "estimatedMinutes": 8,
  "sourceLineage": { "statement": "eigenständig entwickelte Teststruktur-Aufgabe", "seed": 2401 },
  "rightsId": "ki-lernplattform-original",
  "releaseStatus": "solver-verified",
  "testedSeedCount": 1,
  "masteryEligible": true,
  "active": true,
  "legacyWeekId": "w04"
}
