{
  "definitionId": "f-algebra-final-boss-01",
  "version": 1,
  "locale": "de",
  "title": "Final Boss: fehlerhafte Termkette reparieren",
  "competencyIds": ["c-algebra-basics", "c-algebra"],
  "activityType": "algebraic-expression",
  "graderId": "pyodide-sympy",
  "generatorId": null,
  "referenceSolverId": null,
  "deterministicSeed": 5902,
  "prompt": "Eine Rechnung behauptet $3(2x-5)-2(x+4)+7=6x-15-2x+8+7=4x$. Repariere die Fehlerkette und gib nur den vollständig vereinfachten korrekten Term ein.",
  "parameters": {},
  "expectedAnswer": { "kind": "expression", "expression": "4*x - 16", "equivalence": "sympy: simplify(expand(student) - expand(expected)) == 0" },
  "tolerancePolicy": { "mode": "exact-symbolic" },
  "hints": ["Das Minus vor $2(x+4)$ wirkt auf beide Summanden.", "Fasse erst nach vollständigem Ausmultiplizieren x-Terme und Konstanten getrennt zusammen."],
  "feedbackRules": [{ "if": "unparsed", "then": "Nutze ^ oder ** für Potenzen und * oder implizite Multiplikation." }],
  "fullSolution": "$3(2x-5)-2(x+4)+7=6x-15-2x-8+7=4x-16$. Der erste Fehler der Behauptung ist das Vorzeichen vor 8; danach wurde der konstante Anteil fälschlich verworfen.",
  "difficulty": 4,
  "estimatedMinutes": 12,
  "sourceLineage": { "statement": "Eigenständig entwickelte Transferaufgabe zu Distributivgesetz, Vorzeichen und Fehlerdiagnose.", "seed": 5902 },
  "rightsId": "ki-lernplattform-original",
  "releaseStatus": "solver-verified",
  "testedSeedCount": 20,
  "masteryEligible": true,
  "active": true,
  "legacyWeekId": null,
  "workedExample": null,
  "rubric": null,
  "typicalErrors": ["Minus nicht in die Klammer verteilen", "Konstanten verwerfen", "zu früh zusammenfassen"]
}
