{
  "definitionId": "f-files-choice-01",
  "version": 2,
  "locale": "de",
  "title": "Fehlergrenze wählen",
  "competencyIds": ["c-python-files-errors"],
  "activityType": "single-choice",
  "graderId": "deterministic",
  "generatorId": null,
  "referenceSolverId": null,
  "deterministicSeed": 2301,
  "prompt": "`parse_age` wirft bei ungültigem Text `ValueError`. Wo sollte der CLI-Datenprüfer diesen erwarteten Fehler behandeln?",
  "parameters": {},
  "choices": [
    { "id": "a", "text": "Dort, wo eine Zeile in einen konkreten Issue-Eintrag übersetzt werden kann.", "correct": true },
    { "id": "b", "text": "Ganz innen mit `except Exception: pass`, damit kein Fehler sichtbar bleibt.", "correct": false },
    { "id": "c", "text": "Gar nicht; jede ungültige CSV-Zelle soll das ganze Programm beenden.", "correct": false },
    { "id": "d", "text": "In jedem Funktionsaufruf unabhängig davon, ob eine Entscheidung möglich ist.", "correct": false }
  ],
  "expectedAnswer": { "correctChoice": "a" },
  "tolerancePolicy": { "mode": "none" },
  "hints": ["Ein Handler braucht genug Kontext für eine sinnvolle Reaktion.", "Breites Verschlucken würde auch Programmierfehler verdecken."],
  "feedbackRules": [{ "if": "choice !== 'a'", "then": "Trenne erwartete Dateneingabefehler von unerwarteten Programmfehlern." }],
  "fullSolution": "Der Aufrufer kennt Zeilennummer und Spalte und kann den ValueError dort in einen präzisen Issue-Eintrag übersetzen.",
  "difficulty": 1,
  "estimatedMinutes": 7,
  "sourceLineage": { "statement": "eigenständig entwickelte Fehlergrenzen-Aufgabe", "seed": 2301 },
  "rightsId": "ki-lernplattform-original",
  "releaseStatus": "solver-verified",
  "testedSeedCount": 1,
  "masteryEligible": true,
  "active": true,
  "legacyWeekId": "w03"
}
