{
  "definitionId": "f-algebra-both-sides-01",
  "version": 1,
  "locale": "de",
  "title": "Gleichung mit Variablen auf beiden Seiten",
  "competencyIds": ["c-algebra-basics", "c-algebra"],
  "activityType": "numeric",
  "graderId": "deterministic",
  "generatorId": "genLinearBothSides",
  "referenceSolverId": null,
  "deterministicSeed": 5901,
  "prompt": "Löse die Gleichung $2x+9=8x+33$. Sammle zuerst alle x-Terme auf einer Seite und gib x als ganze Zahl ein.",
  "parameters": { "a": 2, "b": 9, "c": 8, "d": 33 },
  "expectedAnswer": { "kind": "integer", "value": -4 },
  "tolerancePolicy": { "mode": "exact-integer" },
  "hints": ["Subtrahiere denselben x-Term auf beiden Seiten.", "Führe am Ende eine Probe in der ursprünglichen Gleichung durch."],
  "feedbackRules": [{ "if": "wrong-sign", "then": "Prüfe das Vorzeichen, wenn du die x-Terme auf eine Seite bringst." }],
  "fullSolution": "$2x+9=8x+33$ führt auf $-6x=24$ und damit $x=-4$. Die Probe liefert auf beiden Seiten 1.",
  "difficulty": 3,
  "estimatedMinutes": 9,
  "sourceLineage": { "statement": "Eigenständig entwickelte, deterministisch generierte Gleichungsfamilie.", "seed": 5901 },
  "rightsId": "ki-lernplattform-original",
  "releaseStatus": "solver-verified",
  "testedSeedCount": 300,
  "masteryEligible": true,
  "active": true,
  "legacyWeekId": null,
  "workedExample": null,
  "rubric": null,
  "typicalErrors": ["Vorzeichen beim Seitentausch verlieren", "nur eine Seite verändern", "Probe auslassen"]
}
